{
  "version": 1,
  "corpus_root": "corpus/",
  "libraries": [
    {
      "id": "library-demo",
      "kind": "library",
      "name": "Demo Library",
      "path": "samples/demo-library",
      "enabled": true,
      "auto_registered": false,
      "description": "Minimal scaffolding reference shipped with the engine; demonstrates the CONCEPT -> PATTERN -> APPLY three-lens library shape.",
      "tags": ["sample", "demo"]
    }
  ],
  "skills": [
    {
      "id": "skill-demo",
      "kind": "skill",
      "name": "Demo Skill",
      "path": "samples/demo-skill",
      "enabled": true,
      "auto_registered": false,
      "description": "Minimal example skill package shipped with the engine.",
      "external_deps": []
    }
  ],
  "kits": [],
  "tools": [],
  "lifecycle": {
    "watch_enabled": false,
    "schedule": null,
    "auto_register_new_folders": true,
    "on_toggle_reindex": "next-cycle"
  }
}
